{
  "@odata.etag": "example_value",
  "id": "abc123",
  "documentId": "500123",
  "sequence": 10,
  "itemId": "500123",
  "accountId": "500123",
  "lineType": "example_value",
  "lineObjectNumber": "example_value",
  "description": "A sample description.",
  "description2": "example_value",
  "unitOfMeasureId": "500123",
  "unitOfMeasureCode": "example_value",
  "quantity": 42.5,
  "directUnitCost": 42.5,
  "discountAmount": 42.5,
  "discountPercent": 42.5,
  "discountAppliedBeforeTax": true,
  "amountExcludingTax": 42.5,
  "taxCode": "example_value",
  "taxPercent": 42.5,
  "totalTaxAmount": 42.5,
  "amountIncludingTax": 42.5,
  "expectedReceiptDate": "example_value",
  "receivedQuantity": 42.5,
  "invoicedQuantity": 42.5,
  "invoiceQuantity": 42.5,
  "receiveQuantity": 42.5
}